id,title,URL
1,Scheduling a RingCentral Video meeting,https://support.ringcentral.com/video/joining-scheduling/scheduling-ringcentral-video-meeting-app-desktop-web.html#outlook
2,Turning on on-demand or automatic call recording,https://support.ringcentral.com/mvp/admin/company-account-settings/turning-on-on-demand-automatic-call-recording.html
3,Monitoring calls for other extensions in the RingCentral app desktop and web,https://support.ringcentral.com/app/phone/desktop-web/monitoring-calls-other-extensions-ringcentral-app-desktop-web.html
4,Intro to the RingCentral app,https://support.ringcentral.com/app/overview/desktop-web/intro-to-the-ringcentral-app.html
5,Configuring Analytics Portal permissions,https://support.ringcentral.com/mvp/analytics/overview/configuring-analytics-portal-permissions.html
6,Porting,https://support.ringcentral.com/porting.html
7,Why can’t I see annotations from the host or panelist in a webinar?,https://support.ringcentral.com/webinar/panelist-and-attendee/during-webinar/cannot-see-annotations-from-host-panelist-webinar.html
8,Why can’t I resend a panelist invite to myself after changing my email?,https://support.ringcentral.com/webinar/panelist-and-attendee/during-webinar/cannot-resend-panelist-invite-myself-after-changing-email.html
9,Why is my avatar initials in a webinar “AU”?,https://support.ringcentral.com/webinar/panelist-and-attendee/during-webinar/why-avatar-initials-webinar-au.html
10,Why can’t I resend a panelist invite to myself after changing my email?,https://support.ringcentral.com/webinar/panelist-and-attendee/during-webinar/cannot-resend-panelist-invite-myself-after-changing-email.html
11,Why can’t I manage the webinar in the mobile app after being promoted as a cohost?,https://support.ringcentral.com/webinar/panelist-and-attendee/during-webinar/cannot-manage-webinar-mobile-app-after-being-promoted-cohost.html
12,Invited cohosts show up as panelists during a RingCentral Webinar,https://support.ringcentral.com/webinar/troubleshooting/invited-cohosts-show-up-panelists-during-ringcentral-webinar.html
13,Why was my audio disconnected when rejoining a webinar after encountering a crash?,https://support.ringcentral.com/webinar/host-cohost/during-webinar/why-audio-disconnected-rejoining-webinar-after-crash.html
14,RingCentral Webinar audio continues when accepting a call on an Android device,https://support.ringcentral.com/webinar/troubleshooting/ringcentral-webinar-audio-continues-accepting-call-android-device.html
15,Why can’t I open the RingCentral mobile app when joining a webinar from an Android mobile browser?,https://support.ringcentral.com/webinar/panelist-and-attendee/during-webinar/cannot-open-ringcentral-mobile-when-joining-webinar-android-browser.html
16,Unable to see cohosts’ or panelists’ roles in details of past webinars,https://support.ringcentral.com/webinar/troubleshooting/unable-to-see-cohosts-panelists-role-details-past-webinars.html
17,Why is my question taking too long to send in RingCentral Webinar?,https://support.ringcentral.com/webinar/panelist-and-attendee/during-webinar/why-question-taking-too-long-send-ringcentral-webinar.html
18,Flipping a call in the RingCentral app desktop and web,https://support.ringcentral.com/app/phone/desktop-web/flipping-call-ringcentral-app-desktop-web.html
19,Starting a conference call in the RingCentral app desktop and web,https://support.ringcentral.com/app/phone/desktop-web/starting-conference-call-ringcentral-app-desktop-web.html
20,Intro to Call Forwarding and Voicemail,https://support.ringcentral.com/article/Call-Handling-Forwarding-Overview.html
21,Adding a company greeting to a single-level IVR,https://support.ringcentral.com/mvp/admin/phone-system/adding-company-greeting-to-single-level-ivr.html
22,Setting up how incoming calls are handled,https://support.ringcentral.com/mvp/phone/call-handling-forwarding/setting-up-how-incoming-calls-are-handled.html
23,Setting up your voicemail greeting,https://support.ringcentral.com/mvp/phone/call-handling-forwarding/setting-up-voicemail-greeting.html
24,Setting up how company calls are handled in a single-level IVR,https://support.ringcentral.com/mvp/admin/company-account-setup-ringcentral-app/setting-up-how-company-calls-handled-in-single-level-ivr.html
25,Intro to Call Forwarding and Voicemail,https://support.ringcentral.com/article/Call-Handling-Forwarding-Overview.html
26,Integrating your headset with RingCentral Phone,https://support.ringcentral.com/mvp/phone/ringcentral-phone-app/integrating-headset-with-ringcentral-phone.html
27,Audio Conference Overview,https://support.ringcentral.com/article/7221.html
28,Intro to Real-time reporting,https://support.ringcentral.com/engagevoice/analytics/voice-analytics-intro-real-time-report.html
29,Real-time reporting IVR widget metrics,https://support.ringcentral.com/engagevoice/analytics/real-time-reporting-ivr-widget-metrics.html
30,Creating a new Real-time reporting dashboard,https://support.ringcentral.com/engagevoice/analytics/creating-new-real-time-reporting-dashboard.html
31,Sharing a Real-time reporting dashboard,https://support.ringcentral.com/engagevoice/analytics/sharing-real-time-reporting-dashboard.html
32,Deleting a Real-time reporting dashboard,https://support.ringcentral.com/engagevoice/analytics/deleting-real-time-reporting-dashboard.html
33,Adding widgets in the Real-time dashboard,https://support.ringcentral.com/engagevoice/analytics/voice-analytics-add-widgets.html
34,Configuring pre-built widgets in the Real-time dashboard,https://support.ringcentral.com/engagevoice/analytics/voice-analytics-configure-pre-built-widgets.html
35,Configuring custom widgets in the Real-time dashboard,https://support.ringcentral.com/engagevoice/analytics/voice-analytics-configure-custom-widgets.html
36,RingCentral Video network requirements,https://support.ringcentral.com/video/overview/ringcentral-video-network-requirements.html
37,RingCentral Video system requirements,https://support.ringcentral.com/video/overview/ringcentral-video-system-requirements.html